{"ae_framework":{"commit":"bba9b6846608359b87ed5393cb208e321f3ba8af","package":{"name":"ae-framework","version":"1.0.0"},"pin_digest":"sha256:7476eece164e3e82af99537c686e6bf98dcf084ac78d371b8a8a6f310d2e0778","repository":"itdojp/ae-framework"},"artifact_status":"test-only","build_provenance_digest":"sha256:df3f8b457f066a1ff19f27105901c8aecd69d32625a1cdf691e7dabf2fe321a9","claims":{"results":[{"assumption_ids":[],"claim_id":"PM-CLAIM-6001","declared_status":"supported","evidence_ids":["PM-EVIDENCE-6001"],"evidence_statuses":["pass"],"limitation_ids":["PM-LIMITATION-6001","PM-LIMITATION-6002"],"reason_code":"required-evidence-pass","result":"supported"},{"assumption_ids":[],"claim_id":"PM-CLAIM-6002","declared_status":"supported","evidence_ids":["PM-EVIDENCE-6001","PM-EVIDENCE-6003"],"evidence_statuses":["pass","pass"],"limitation_ids":["PM-LIMITATION-6001","PM-LIMITATION-6002"],"reason_code":"required-evidence-pass","result":"supported"},{"assumption_ids":["PM-ASSUMPTION-6001"],"claim_id":"PM-CLAIM-6003","declared_status":"supported-with-assumptions","evidence_ids":["PM-EVIDENCE-6002"],"evidence_statuses":["pass"],"limitation_ids":["PM-LIMITATION-6001","PM-LIMITATION-6002"],"reason_code":"evidence-pass-assumptions-visible","result":"supported-with-assumptions"},{"assumption_ids":[],"claim_id":"PM-CLAIM-6004","declared_status":"supported","evidence_ids":["PM-EVIDENCE-6003"],"evidence_statuses":["pass"],"limitation_ids":["PM-LIMITATION-6001","PM-LIMITATION-6002"],"reason_code":"required-evidence-pass","result":"supported"}],"status_counts":{"invalid-reference":0,"not-evaluated":0,"not-supported":0,"supported":3,"supported-with-assumptions":1}},"conformance":{"complete_suite_tree_digest":"sha256:a85f3fb73190a26f8e048ab764ff5fd5f051f2a96047087a096c4ee194a8ab28","identifier":"private-match-core","semantic_digest":"sha256:83787c69ec1128eb9ba4b8dcdfcb4ae218674b6158cd8c6c573d898a6f72ceba","version":"0.1"},"evidence_status_counts":{"fail":0,"pass":3,"skip":0,"timeout":0,"tool-error":0,"unsupported":1},"limitations":["Synthetic fixture data and fixture keys do not establish a Product release.","Signature validity establishes origin and integrity only relative to the supplied trust root; it is not security certification.","The supplied fixture trust root is an external verifier input whose authenticity is not established by the bundle.","No trusted timestamp or transparency log is used; compromise revocation applies conservatively to all signatures under the affected key.","The verifier validates the complete supplied status chain but cannot prove that it is the globally latest distributed revision.","Production signing, key custody, publication approval, and automated publication are unsupported in Draft 0.1."],"profiles":{"assurance":{"digest":"sha256:1ca9838e28a723fad7666aa187aeed77f19ae2b250b4dbc5958ec36e3e1276c5","id":"private-match-ae-assurance","version":"0.1"},"export":{"digest":"sha256:546a139d100951c3836a454115e3dbf6ee1effef973e129cb82ff60a9fcf128d","id":"private-match-public-evidence-export","version":"0.1"}},"protocol":{"commit":"9bb59d3b5e1435885fdea60280d6602f937305c9","identifier":"private-match-core","semantic_digest":"sha256:32e514a61a83aeb1593623eb1144f323d1115dc8c812b5fd72af93a3ae06ba16","version":"0.1"},"publication":{"automation_permitted":false,"ci_artifact_upload":"absent","final_publication_approval":"not-applicable-test-only","github_release_creation":"absent","product_release_signing":"unsupported","production_signing":"unsupported"},"record_counts":{"assumptions":1,"claims":4,"evidence":4,"limitations":2},"release":{"bundle_revision":1,"channel":"fixture","release_id":"private-match-assurance-fixture-release-0.1.0","version":"0.1.0"},"release_artifact_digest":"sha256:dd105fded85a3242a4300bd23b309d123bf152c69ab210b653834a268fc8484b","sbom_digest":"sha256:84b97ef07a8c89f2432027934db77533dccd372d7ff94d0e19fd4315f5737d0e","schema_version":"0.1","signing":{"algorithm":"ed25519-rfc8032","key_id":"sha256:06e3fd8fda29bb60ab59557de61edb0aecdb231134be30e75b455f8e1b792fa9","payload_type":"application/vnd.itdo.private-match.assurance-release-manifest.v0.1+json","trust_domain_id":"itdo-private-match-assurance-fixture-v0.1"},"source_revision_digest":"sha256:d1d1d1d1d1d1d1d1d1d1d1d1d1d1d1d1d1d1d1d1d1d1d1d1d1d1d1d1d1d1d1d1","subject":{"digest":"sha256:a6a6a6a6a6a6a6a6a6a6a6a6a6a6a6a6a6a6a6a6a6a6a6a6a6a6a6a6a6a6a6a6","identifier":"private-match-synthetic-public-release-fixture","type":"build-artifact","version":"0.1.0"}}